### ISSUE TITLE
pip cannot use the correct network adapter

### ISSUE THREAD

**Issue by zsynacl** [pypa/warehouse#1497]
I had 2 network adapters installed on my PC, one for Internet and another for local network.

I tried to install some package using pip like `pip install setuptools` and I got:

> Collecting setuptools
>   Retrying (Retry(total=4, connect=None, read=None, redirect=None)) after connection broken by 'ReadTimeoutError("HTTPSConnectionPool(host='pypi.tuna.tsinghua.edu.cn', port=443): Read timed out. (read timeout=15)",)': /simple/setuptools/

I tried tcpdump and I found packages towards pypi.tuna.tsinghua.edu.cn were tried to be sent through my local network:

enp2s0 was my adapter for local network
`sudo tcpdump -i enp2s0 dst pypi.tuna.tsinghua.edu.cn`
> tcpdump: verbose output suppressed, use -v or -vv for full protocol decode
> listening on enp2s0, link-type EN10MB (Ethernet), capture size 262144 bytes
> 20:39:20.845958 IP6 2001:da8:d800:114:1886:9e28:9007:17fd.57926 > 2402:f000:1:416:166:111:206:63.https: Flags [S], seq 2303845454, win 28800, options [mss 1440,sackOK,TS val 4066911 ecr 0,nop,wscale 7], length 0
> 20:39:20.920497 IP6 2001:da8:d800:114:1886:9e28:9007:17fd.57926 > 2402:f000:1:416:166:111:206:63.https: Flags [.], ack 4008541820, win 225, options [nop,nop,TS val 4066929 ecr 1714565771], length 0
> 20:39:20.926338 IP6 2001:da8:d800:114:1886:9e28:9007:17fd.57926 > 2402:f000:1:416:166:111:206:63.https: Flags [P.], seq 0:517, ack 1, win 225, options [nop,nop,TS val 4066931 ecr 1714565771], length 517

and I got nothing on another adapter.

Anybody knows how to work this out?
thanks a lot.

**Comment by di** [comment]
Hi @zsynacl! This repository is for Warehouse, the Python Package Index at https://pypi.org/.

It looks like you're using an alternative index, `pypi.tuna.tsinghua.edu.cn`, and your issue is either with your network or that index provider. You might want to try asking [here](https://groups.google.com/forum/#!forum/tuna-general) instead.

**Comment by zsynacl** [comment]
But I'm pretty sure the tuna was ok and so did my network because as soon as I shutdown the second adapter, the pip would install things successfully.
